id,msg_timestamp,img_url,user_msg,bot_msg,sum_msg,date,runtime,feedback,user_id
54,1708921848337,https://th.bing.com/th/id/R.498589db9a3498c7ea59697b1a199c76?rik=HyKxZeH0PARdhg&riu=http%3a%2f%2fimages6.fanpop.com%2fimage%2fphotos%2f36600000%2fDisney-Princess-image-disney-princess-36601083-300-169.jpg&ehk=fvIt5U5Z1k3tW47il1XI%2fmDkt34M%2f28RUHwgrh7YV3g%3d&risl=&pid=ImgRaw&r=0,What is special about her?,She is an animated character from Disney's The Little Mermaid.,She is an animated character from Disney's The Little Mermaid.,2024-02-26 04:30:51.000000,2.0196166038513184,like,2
55,1708921870170,https://th.bing.com/th/id/R.498589db9a3498c7ea59697b1a199c76?rik=HyKxZeH0PARdhg&riu=http%3a%2f%2fimages6.fanpop.com%2fimage%2fphotos%2f36600000%2fDisney-Princess-image-disney-princess-36601083-300-169.jpg&ehk=fvIt5U5Z1k3tW47il1XI%2fmDkt34M%2f28RUHwgrh7YV3g%3d&risl=&pid=ImgRaw&r=0,Who is her best friend?,ariel 2,ariel 2,2024-02-26 04:31:12.000000,1.1129860877990723,dislike,2
56,1708921884724,https://th.bing.com/th/id/R.498589db9a3498c7ea59697b1a199c76?rik=HyKxZeH0PARdhg&riu=http%3a%2f%2fimages6.fanpop.com%2fimage%2fphotos%2f36600000%2fDisney-Princess-image-disney-princess-36601083-300-169.jpg&ehk=fvIt5U5Z1k3tW47il1XI%2fmDkt34M%2f28RUHwgrh7YV3g%3d&risl=&pid=ImgRaw&r=0,Is she beautiful?,yes yes 2,yes yes 2,2024-02-26 04:31:26.000000,1.1254932880401611,dislike,2
57,1708921897323,https://th.bing.com/th/id/R.498589db9a3498c7ea59697b1a199c76?rik=HyKxZeH0PARdhg&riu=http%3a%2f%2fimages6.fanpop.com%2fimage%2fphotos%2f36600000%2fDisney-Princess-image-disney-princess-36601083-300-169.jpg&ehk=fvIt5U5Z1k3tW47il1XI%2fmDkt34M%2f28RUHwgrh7YV3g%3d&risl=&pid=ImgRaw&r=0,How is she feeling in the image?,"In the image, Ariel is feeling sad and worried.","In the image, Ariel is feeling sad and worried.",2024-02-26 04:31:40.000000,1.8090722560882568,like,2
58,1708921913580,https://th.bing.com/th/id/R.498589db9a3498c7ea59697b1a199c76?rik=HyKxZeH0PARdhg&riu=http%3a%2f%2fimages6.fanpop.com%2fimage%2fphotos%2f36600000%2fDisney-Princess-image-disney-princess-36601083-300-169.jpg&ehk=fvIt5U5Z1k3tW47il1XI%2fmDkt34M%2f28RUHwgrh7YV3g%3d&risl=&pid=ImgRaw&r=0,What could be the reason for that?,"In the image, Ariel from The Little Mermaid is standing in a dark forest with her hair flowing in the wind. She is wearing a red bikini top and blue pants. The reason for her being in the forest could be that she is exploring or searching for something. As an animated character, Ariel is known for her adventurous nature and love for exploration, so it is possible that she is on a mission to discover new things or find something of interest in the forest. This scene could also be part of a storyline or animation where Ariel is facing challenges or overcoming obstacles in her journey.","In the image, Ariel from The Little Mermaid is standing in a dark forest with her hair flowing in the wind. She is wearing a red bikini top and blue pants. The reason for her being in the forest could be that she is exploring or searching for something. As an animated character, Ariel is known for her adventurous nature and love for exploration, so it is possible that she is on a mission to discover new things or find something of interest in the forest. This scene could also be part of a storyline or animation where Ariel is facing challenges or overcoming obstacles in her journey.",2024-02-26 04:32:07.000000,12.650784730911255,dislike,2
59,1708921947127,https://th.bing.com/th/id/R.498589db9a3498c7ea59697b1a199c76?rik=HyKxZeH0PARdhg&riu=http%3a%2f%2fimages6.fanpop.com%2fimage%2fphotos%2f36600000%2fDisney-Princess-image-disney-princess-36601083-300-169.jpg&ehk=fvIt5U5Z1k3tW47il1XI%2fmDkt34M%2f28RUHwgrh7YV3g%3d&risl=&pid=ImgRaw&r=0,Does she has a lover?,no,no,2024-02-26 04:32:28.000000,0.9555752277374268,dislike,2
60,1708921969783,https://th.bing.com/th/id/R.498589db9a3498c7ea59697b1a199c76?rik=HyKxZeH0PARdhg&riu=http%3a%2f%2fimages6.fanpop.com%2fimage%2fphotos%2f36600000%2fDisney-Princess-image-disney-princess-36601083-300-169.jpg&ehk=fvIt5U5Z1k3tW47il1XI%2fmDkt34M%2f28RUHwgrh7YV3g%3d&risl=&pid=ImgRaw&r=0,Who does she fall in love with?,prince eric 2,prince eric 2,2024-02-26 04:32:51.000000,1.2237160205841064,dislike,2
61,1708922000199,https://th.bing.com/th/id/R.498589db9a3498c7ea59697b1a199c76?rik=HyKxZeH0PARdhg&riu=http%3a%2f%2fimages6.fanpop.com%2fimage%2fphotos%2f36600000%2fDisney-Princess-image-disney-princess-36601083-300-169.jpg&ehk=fvIt5U5Z1k3tW47il1XI%2fmDkt34M%2f28RUHwgrh7YV3g%3d&risl=&pid=ImgRaw&r=0,What happened to them?,"The Little Mermaid was released in 1989, so it is possible that the character depicted in the image is Ariel from The Little Mermaid (1989). However, it is also possible that the character depicted in the image is not Ariel from The Little Mermaid (1989), but another character from a different Disney film or television show.","The Little Mermaid was released in 1989, so it is possible that the character depicted in the image is Ariel from The Little Mermaid (1989). However, it is also possible that the character depicted in the image is not Ariel from The Little Mermaid (1989), but another character from a different Disney film or television show.",2024-02-26 04:33:28.000000,8.028806924819946,dislike,2
62,1708922115500,https://cdn.static-economist.com/sites/default/files/images/2015/09/blogs/economist-explains/code2.png,Describe this image.,"The image showcases a computer screen displaying a list of code snippets. The code appears to be written in Python, with several lines of code visible on the screen. The code is organized into multiple sections, each containing a few lines of code. Some of the code snippets are highlighted, indicating their importance or relevance to the overall program. There are also various comments throughout the code, which provide additional context and information about the program's functionality. The code appears to be well-structured and organized, making it easier to understand and work with.","The image showcases a computer screen displaying a list of code snippets. The code appears to be written in Python, with several lines of code visible on the screen. The code is organized into multiple sections, each containing a few lines of code. Some of the code snippets are highlighted, indicating their importance or relevance to the overall program. There are also various comments throughout the code, which provide additional context and information about the program's functionality. The code appears to be well-structured and organized, making it easier to understand and work with.",2024-02-26 04:35:26.000000,10.799514055252075,like,2
63,1708922179165,https://cdn.static-economist.com/sites/default/files/images/2015/09/blogs/economist-explains/code2.png,What does the code do?,"The code appears to be a set of instructions for a computer program, specifically for a web application. It is written in Python and contains various functions and methods for handling user input and displaying data on a web page. The code is designed to work with the Flask web framework, which is used to build web applications in Python.","The code appears to be a set of instructions for a computer program, specifically for a web application. It is written in Python and contains various functions and methods for handling user input and displaying data on a web page. The code is designed to work with the Flask web framework, which is used to build web applications in Python.",2024-02-26 04:36:25.000000,6.572345018386841,like,2
64,1708922211390,https://cdn.static-economist.com/sites/default/files/images/2015/09/blogs/economist-explains/code2.png,What do I have to learn to do this?,javascript,javascript,2024-02-26 04:36:52.000000,0.7881467342376709,dislike,2
65,1708922223023,https://cdn.static-economist.com/sites/default/files/images/2015/09/blogs/economist-explains/code2.png,Is it hard to be a coder?,no,no,2024-02-26 04:37:03.000000,0.7818121910095215,dislike,2
66,1708922235311,https://cdn.static-economist.com/sites/default/files/images/2015/09/blogs/economist-explains/code2.png,Can AI write this?,no,no,2024-02-26 04:37:16.000000,0.7690222263336182,dislike,2
67,1708922270897,https://cdn.static-economist.com/sites/default/files/images/2015/09/blogs/economist-explains/code2.png,Is it fun to write this?,no,no,2024-02-26 04:37:51.000000,0.7824912071228027,dislike,2
68,1708922291810,https://cdn.static-economist.com/sites/default/files/images/2015/09/blogs/economist-explains/code2.png,Why is it not fun?,It is not fun because it is a computer screen with code,It is not fun because it is a computer screen with code,2024-02-26 04:38:13.000000,1.8097031116485596,dislike,2
69,1708922305236,https://cdn.static-economist.com/sites/default/files/images/2015/09/blogs/economist-explains/code2.png,What theme is it?,It is not possible to determine the theme of this screenshot as it only shows a computer screen displaying code and text. There is no visual context or information provided to suggest a theme or topic related to the content displayed on the screen.,It is not possible to determine the theme of this screenshot as it only shows a computer screen displaying code and text. There is no visual context or information provided to suggest a theme or topic related to the content displayed on the screen.,2024-02-26 04:38:30.000000,4.773698329925537,dislike,2
70,1708922365788,https://cdn.static-economist.com/sites/default/files/images/2015/09/blogs/economist-explains/code2.png,How many lines is this?,10,10,2024-02-26 04:39:26.000000,0.9680314064025879,dislike,2
71,1708922388117,https://cdn.static-economist.com/sites/default/files/images/2015/09/blogs/economist-explains/code2.png,Which library do I need for this code?,twitter,twitter,2024-02-26 04:39:49.000000,0.8012974262237549,dislike,2
72,1708922406933,https://cdn.static-economist.com/sites/default/files/images/2015/09/blogs/economist-explains/code2.png,Does this code work?,yes,yes,2024-02-26 04:40:08.000000,0.7783219814300537,dislike,2
