id,msg_timestamp,img_url,user_msg,bot_msg,sum_msg,date,runtime,feedback,user_id
1,1708918919467,https://www.kone.sg/Images/Marina%20Bay%20Sands_1440x670_tcm95-41518.jpg,Describe this image.,"The image showcases a modern city skyline with several tall buildings, including a large white structure in the center of the scene. The buildings are situated near a body of water, possibly a river or a lake, which is visible in the background.  There are several people scattered throughout the scene, some closer to the buildings and others further away. Some of the people are standing near the water's edge, while others can be seen walking along the street or sitting on benches. A few cars are also visible in the scene, parked near the buildings or driving along the road. Additionally, there is a boat floating in the water, adding to the scenic view of the city.","The image showcases a modern city skyline with several tall buildings, including a large white structure in the center of the scene. The buildings are situated near a body of water, possibly a river or a lake, which is visible in the background. There are several people scattered throughout the scene, some closer to the buildings and others further away.",2024-02-26 03:42:25.000000,25.214589595794678,like,1
2,1708918948293,https://www.kone.sg/Images/Marina%20Bay%20Sands_1440x670_tcm95-41518.jpg,What is the name of the city that you are describing?,singapore,singapore,2024-02-26 03:42:29.000000,0.9640283584594727,like,1
3,1708918962453,https://www.kone.sg/Images/Marina%20Bay%20Sands_1440x670_tcm95-41518.jpg,What is the name of the building complex that consists of three towers and a horizontal structure on top?,Marina Bay Sands,Marina Bay Sands,2024-02-26 03:42:43.000000,1.0783143043518066,like,1
4,1708918969676,https://www.kone.sg/Images/Marina%20Bay%20Sands_1440x670_tcm95-41518.jpg,What is the name of the horizontal structure that connects them?,Bridge,Bridge,2024-02-26 03:42:50.000000,0.8093385696411133,dislike,1
5,1708918975508,https://www.kone.sg/Images/Marina%20Bay%20Sands_1440x670_tcm95-41518.jpg,What is the height of the sky park and how much does it weigh?,"The Marina Bay Sands SkyPark is approximately 200 meters (656 feet) high, making it one of the highest observation decks in the world. Its weight is estimated to be around 34,000 metric tons, which is a significant amount of weight for a structure of this height. The Marina Bay Sands SkyPark is an impressive architectural feat and a popular tourist attraction in Singapore, offering visitors breathtaking views of the city skyline and surrounding waters.","The Marina Bay Sands SkyPark is approximately 200 meters (656 feet) high. Its weight is estimated to be around 34,000 metric tons, which is a significant amount of weight for a structure of this height. The SkyPark offers visitors breathtaking views of the city skyline and surrounding waters.",2024-02-26 03:43:10.000000,14.704391717910767,like,1
6,1708919030758,https://www.kone.sg/Images/Marina%20Bay%20Sands_1440x670_tcm95-41518.jpg,What is the length and width of the horizontal structure that connects them?,The length and width of the horizontal structure that connects the two buildings is not specified in the image.,The length and width of the horizontal structure that connects the two buildings is not specified in the image. It is not known how long the structure will be when it is completed. The building will be completed by the end of the year. It will be built on the site of a former church.,2024-02-26 03:43:58.000000,7.512900352478027,dislike,1
7,1708919047696,https://www.kone.sg/Images/Marina%20Bay%20Sands_1440x670_tcm95-41518.jpg,What can visitors do there?,"Visitors can explore the Marina Bay Sands complex and its various amenities, such as shopping, dining, entertainment, and hotel accommodations. They can also take a stroll along the promenade and enjoy the scenic views of the Singapore skyline and the waterfront. Additionally, visitors can attend events and concerts at the Marina Bay Sands Event Plaza or participate in outdoor activities such as kayaking or boating on the water. The Marina Bay Sands complex offers a diverse range of experiences for visitors to enjoy, making it a popular destination for both locals and tourists alike.","Visitors can explore the Marina Bay Sands complex and its various amenities, such as shopping, dining, entertainment, and hotel accommodations. They can also take a stroll along the promenade and enjoy the scenic views of the Singapore skyline and the waterfront. Visitors can attend events and concerts at the MarinaBay Sands Event Plaza or participate in outdoor activities such as kayaking or boating on the water.",2024-02-26 03:44:25.000000,17.98455548286438,like,1
8,1708919070993,https://www.kone.sg/Images/Marina%20Bay%20Sands_1440x670_tcm95-41518.jpg,What is the name of the lotus flower-shaped building that is located next to them?,The lotus flower-shaped building is called the Marina Bay Sands.,The lotus flower-shaped building is called the Marina Bay Sands.,2024-02-26 03:44:33.000000,2.140897274017334,dislike,1
9,1708919080137,https://www.kone.sg/Images/Marina%20Bay%20Sands_1440x670_tcm95-41518.jpg,What is the architectural inspiration behind the design of the ArtScience Museum?,"The architectural inspiration behind the design of the ArtScience Museum in Singapore is a combination of modern and futuristic elements. The building's unique shape, resembling a lotus flower, is inspired by traditional Asian art and culture. The lotus flower symbolizes purity, creativity, and spiritual enlightenment in many Asian cultures. This symbolism is reflected in the museum's exhibits, which showcase the intersections between art and science. Additionally, the building's sleek, modern design reflects the city's commitment to innovation and technological advancements. The combination of traditional and modern elements creates a visually striking and memorable structure that serves as an iconic landmark in Singapore's skyline.","The ArtScience Museum in Singapore is a combination of modern and futuristic elements. The building's unique shape, resembling a lotus flower, is inspired by traditional Asian art and culture. The combination of traditional and modern elements creates a visually striking and memorable structure that serves as an iconic landmark in Singapore's skyline.",2024-02-26 03:44:59.000000,19.553425550460815,like,1
10,1708919118954,https://www.kone.sg/Images/Marina%20Bay%20Sands_1440x670_tcm95-41518.jpg,Who is the architect who designed it?,I. M. Pei,I. M. Pei,2024-02-26 03:45:20.000000,1.3461010456085205,dislike,1
11,1708919148788,https://www.kone.sg/Images/Marina%20Bay%20Sands_1440x670_tcm95-41518.jpg,What are some of the distinctive features of his architectural style?,"Some of the distinctive features of the architectural style in the image are the large, modern buildings with unique shapes and designs. These buildings stand out due to their size, shape, and color, which create a striking contrast against the blue sky and water. The buildings appear to be part of a cityscape or urban environment, showcasing the architect's creativity and innovative approach to designing modern structures. The presence of multiple buildings in the image suggests that this architectural style is prevalent in the area, contributing to the overall aesthetic appeal of the city.","Some of the distinctive features of the architectural style in the image are the large, modern buildings with unique shapes and designs. These buildings stand out due to their size, shape, and color, which create a striking contrast against the blue sky and water. The buildings appear to be part of a cityscape or urban environment, showcasing the architect's creativity.",2024-02-26 03:46:05.000000,16.71246576309204,dislike,1
12,1708919178447,https://www.kone.sg/Images/Marina%20Bay%20Sands_1440x670_tcm95-41518.jpg, How many floors does the ArtScience Museum have?,The ArtScience Museum has 10 floors.,The ArtScience Museum has 10 floors.,2024-02-26 03:46:20.000000,1.8721332550048828,dislike,1
13,1708919540602,https://food.fnr.sndimg.com/content/dam/images/food/fullset/2021/02/05/Baked-Feta-Pasta-4_s4x3.jpg.rend.hgtvcom.616.493.suffix/1615916524567.jpeg,Describe this image.,"The image showcases a large white bowl filled with pasta and tomato sauce. The dish is placed on a wooden table, surrounded by various utensils, such as a spoon, a fork, and a knife. The pasta dish has a generous amount of cheese, making it a delicious and hearty meal. The bowl is positioned in the center of the table, inviting diners to enjoy the flavorful pasta dish.","The image showcases a large white bowl filled with pasta and tomato sauce. The dish is placed on a wooden table, surrounded by various utensils, such as a spoon, a fork, and a knife. The pasta dish has a generous amount of cheese, making it a delicious and hearty meal. The bowl is positioned in the center of the table, inviting diners to enjoy the flavorful pasta dish.",2024-02-26 03:52:38.000000,16.999554872512817,like,1
14,1708919567276,https://food.fnr.sndimg.com/content/dam/images/food/fullset/2021/02/05/Baked-Feta-Pasta-4_s4x3.jpg.rend.hgtvcom.616.493.suffix/1615916524567.jpeg,How would you make the sauce that coats it?,"To make the sauce that coats the pasta, you can use a variety of ingredients depending on your preference and taste. Some common ingredients used in pasta sauces include olive oil, garlic, onions, tomatoes, herbs, and spices. For this particular dish, you could add some olive oil to a pan and sauté garlic and onions until fragrant. Then, you can add diced tomatoes, such as canned diced tomatoes or fresh tomatoes, and simmer the sauce for a few minutes until it thickens. Finally, you can season the sauce with various herbs and spices, such as basil, oregano, and red pepper flakes, to give it a unique flavor.","To make the sauce that coats the pasta, you can use a variety of ingredients depending on your preference and taste. Some common ingredients used in pasta sauces include olive oil, garlic, onions, tomatoes, herbs, and spices. For this particular dish, you could add some olive oil to a pan and sauté garlic and onions until fragrant. Then, you can add diced tomatoes, such as canned diced tomatoes or fresh tomatoes, and simmer the sauce for a few minutes until it thickens. Finally, you can season the sauce with various herbs and spices, such as basil, oregano, and red pepper flakes, to give it a unique flavor.",2024-02-26 03:53:03.000000,15.704615592956543,like,1
15,1708919600021,https://food.fnr.sndimg.com/content/dam/images/food/fullset/2021/02/05/Baked-Feta-Pasta-4_s4x3.jpg.rend.hgtvcom.616.493.suffix/1615916524567.jpeg,How many cloves of garlic do you need for it?,There are three cloves of garlic in the pasta dish.,There are three cloves of garlic in the pasta dish.,2024-02-26 03:53:22.000000,2.032864570617676,like,1
16,1708919612029,https://food.fnr.sndimg.com/content/dam/images/food/fullset/2021/02/05/Baked-Feta-Pasta-4_s4x3.jpg.rend.hgtvcom.616.493.suffix/1615916524567.jpeg,What kind of tomatoes do you use?,Cherry tomatoes.,Cherry tomatoes.,2024-02-26 03:53:33.000000,1.132171630859375,like,1
17,1708919617967,https://food.fnr.sndimg.com/content/dam/images/food/fullset/2021/02/05/Baked-Feta-Pasta-4_s4x3.jpg.rend.hgtvcom.616.493.suffix/1615916524567.jpeg,Do you cut them in half before adding them to the sauce or do you leave them whole?,Leave them whole,Leave them whole,2024-02-26 03:53:38.000000,1.0383868217468262,dislike,1
18,1708919624239,https://food.fnr.sndimg.com/content/dam/images/food/fullset/2021/02/05/Baked-Feta-Pasta-4_s4x3.jpg.rend.hgtvcom.616.493.suffix/1615916524567.jpeg,How long do you cook them for?,15 minutes,15 minutes,2024-02-26 03:53:45.000000,1.022270917892456,dislike,1
19,1708919631517,https://food.fnr.sndimg.com/content/dam/images/food/fullset/2021/02/05/Baked-Feta-Pasta-4_s4x3.jpg.rend.hgtvcom.616.493.suffix/1615916524567.jpeg,What do you do with the basil that you mentioned earlier? Do you add it to the sauce or use it as a garnish?,You add it to the sauce.,You add it to the sauce.,2024-02-26 03:53:53.000000,1.4201734066009521,dislike,1
20,1708919644214,https://food.fnr.sndimg.com/content/dam/images/food/fullset/2021/02/05/Baked-Feta-Pasta-4_s4x3.jpg.rend.hgtvcom.616.493.suffix/1615916524567.jpeg,How many servings does it make?,There are three servings of pasta in the dish.,There are three servings of pasta in the dish.,2024-02-26 03:54:06.000000,1.8311567306518555,like,1
21,1708919649398,https://food.fnr.sndimg.com/content/dam/images/food/fullset/2021/02/05/Baked-Feta-Pasta-4_s4x3.jpg.rend.hgtvcom.616.493.suffix/1615916524567.jpeg,How many calories are in each serving?,There are approximately 200 calories in each serving of the pasta dish.,There are approximately 200 calories in each serving of the pasta dish.,2024-02-26 03:54:11.000000,2.380295991897583,like,1
22,1708919659078,https://food.fnr.sndimg.com/content/dam/images/food/fullset/2021/02/05/Baked-Feta-Pasta-4_s4x3.jpg.rend.hgtvcom.616.493.suffix/1615916524567.jpeg,"How much fat, protein, and carbohydrates are in them?","The pasta dish contains a moderate amount of fat, protein, and carbohydrates. The pasta dish is made up of pasta, cheese, tomato sauce, and herbs, which contribute to the overall nutritional content of the dish. The pasta dish has a moderate amount of fat, protein, and carbohydrates, making it a balanced and nutritious meal option.","The pasta dish contains a moderate amount of fat, protein, and carbohydrates. The pasta dish is made up of pasta, cheese, tomato sauce, and herbs, which contribute to the overall nutritional content of the dish. The pasta dish has a moderate amount of fat, protein, and carbohydrates, making it a balanced and nutritious meal option.",2024-02-26 03:54:28.000000,9.25243592262268,like,1
23,1708919671088,https://food.fnr.sndimg.com/content/dam/images/food/fullset/2021/02/05/Baked-Feta-Pasta-4_s4x3.jpg.rend.hgtvcom.616.493.suffix/1615916524567.jpeg,How did you calculate the calories for them? What formula or source did you use?,calorie calculator,calorie calculator,2024-02-26 03:54:32.000000,1.051924705505371,dislike,1
24,1708920290438,https://lh3.googleusercontent.com/_LjVqk-ipAA7AtccR--EdTjnVu8aAcCkr9x74b8S53Yl6JZcrbtlWMqgcbKOWCJ7OMhAhaF2hqEWV-zSQ818aXYgxQSj7aGhkQ=w1600-rj,Describe this image.,"The image features four young women dressed in red and black outfits, posing together for a photo. They are arranged in a line, with the first woman standing closest to the left side of the image, followed by the second woman, then the third woman, and finally the fourth woman on the right side of the image. Each woman has a unique hairstyle, showcasing their individuality.  There are several handbags scattered throughout the scene, indicating that the women may have brought their personal belongings with them for the photo shoot. Additionally, there is a pencil sitting on the ground near the second woman from the left, suggesting that they may have been preparing for a writing task or taking notes during the photo session. Overall, this image captures a fun and stylish moment of the four women posing together in their coordinated outfits.","The image features four young women dressed in red and black outfits, posing together for a photo. They are arranged in a line, with the first woman standing closest to the left side of the image, followed by the second woman, then the third woman, and finally the fourth woman on the right side of the image. Each woman has a unique hairstyle, showcasing their individuality.  There are several handbags scattered throughout the scene, indicating that the women may have brought their personal belongings with them for the photo shoot. Additionally, there is a pencil sitting on the ground near the second woman from the left, suggesting that they may have been preparing for a writing task or taking notes during the photo session. Overall, this image captures a fun and stylish moment of the four women posing together in their coordinated outfits.",2024-02-26 04:05:15.000000,24.79873251914978,like,2
25,1708920332159,https://lh3.googleusercontent.com/_LjVqk-ipAA7AtccR--EdTjnVu8aAcCkr9x74b8S53Yl6JZcrbtlWMqgcbKOWCJ7OMhAhaF2hqEWV-zSQ818aXYgxQSj7aGhkQ=w1600-rj,Who are they?,girl group 2ne1,girl group 2ne1,2024-02-26 04:05:33.000000,1.2971503734588623,dislike,2
26,1708920342423,https://lh3.googleusercontent.com/_LjVqk-ipAA7AtccR--EdTjnVu8aAcCkr9x74b8S53Yl6JZcrbtlWMqgcbKOWCJ7OMhAhaF2hqEWV-zSQ818aXYgxQSj7aGhkQ=w1600-rj,What are their names?,red velvet 4minute,red velvet 4minute,2024-02-26 04:05:44.000000,1.3992269039154053,dislike,2
27,1708920353607,https://lh3.googleusercontent.com/_LjVqk-ipAA7AtccR--EdTjnVu8aAcCkr9x74b8S53Yl6JZcrbtlWMqgcbKOWCJ7OMhAhaF2hqEWV-zSQ818aXYgxQSj7aGhkQ=w1600-rj,What are their songs?,"""Lose Control""","""Lose Control""",2024-02-26 04:05:54.000000,1.142444133758545,dislike,2
28,1708920363257,https://lh3.googleusercontent.com/_LjVqk-ipAA7AtccR--EdTjnVu8aAcCkr9x74b8S53Yl6JZcrbtlWMqgcbKOWCJ7OMhAhaF2hqEWV-zSQ818aXYgxQSj7aGhkQ=w1600-rj,Where are they from?,South Korea,South Korea,2024-02-26 04:06:04.000000,0.9484999179840088,like,2
29,1708920371593,https://lh3.googleusercontent.com/_LjVqk-ipAA7AtccR--EdTjnVu8aAcCkr9x74b8S53Yl6JZcrbtlWMqgcbKOWCJ7OMhAhaF2hqEWV-zSQ818aXYgxQSj7aGhkQ=w1600-rj,What do they do?,"They are a group of female performers known as BLACKPINK. They perform music, dance, and entertain their fans through concerts, music videos, and social media.","They are a group of female performers known as BLACKPINK. They perform music, dance, and entertain their fans through concerts, music videos, and social media.",2024-02-26 04:06:15.000000,4.063555955886841,like,2
30,1708920385690,https://lh3.googleusercontent.com/_LjVqk-ipAA7AtccR--EdTjnVu8aAcCkr9x74b8S53Yl6JZcrbtlWMqgcbKOWCJ7OMhAhaF2hqEWV-zSQ818aXYgxQSj7aGhkQ=w1600-rj,What are their songs?,"""Lose Control""","""Lose Control""",2024-02-26 04:06:27.000000,1.1377227306365967,dislike,2
31,1708920398986,https://lh3.googleusercontent.com/_LjVqk-ipAA7AtccR--EdTjnVu8aAcCkr9x74b8S53Yl6JZcrbtlWMqgcbKOWCJ7OMhAhaF2hqEWV-zSQ818aXYgxQSj7aGhkQ=w1600-rj,Are they pretty?,yes yes 2,yes yes 2,2024-02-26 04:06:40.000000,1.2235496044158936,dislike,2
32,1708920408762,https://lh3.googleusercontent.com/_LjVqk-ipAA7AtccR--EdTjnVu8aAcCkr9x74b8S53Yl6JZcrbtlWMqgcbKOWCJ7OMhAhaF2hqEWV-zSQ818aXYgxQSj7aGhkQ=w1600-rj,Who is the most beautiful?,left 2nd from left,left 2nd from left,2024-02-26 04:06:50.000000,1.3219866752624512,dislike,2
33,1708920440267,https://lh3.googleusercontent.com/_LjVqk-ipAA7AtccR--EdTjnVu8aAcCkr9x74b8S53Yl6JZcrbtlWMqgcbKOWCJ7OMhAhaF2hqEWV-zSQ818aXYgxQSj7aGhkQ=w1600-rj,How is their style?,"The girls are dressed in matching red and black outfits, with leather gloves and boots. They have their hair styled in a variety of ways, such as short bangs and longer hair.","The girls are dressed in matching red and black outfits, with leather gloves and boots. They have their hair styled in a variety of ways, such as short bangs and longer hair.",2024-02-26 04:07:24.000000,4.52312970161438,like,2
34,1708920457389,https://lh3.googleusercontent.com/_LjVqk-ipAA7AtccR--EdTjnVu8aAcCkr9x74b8S53Yl6JZcrbtlWMqgcbKOWCJ7OMhAhaF2hqEWV-zSQ818aXYgxQSj7aGhkQ=w1600-rj,How old are they?,young 20s,young 20s,2024-02-26 04:07:38.000000,1.1205472946166992,like,2
35,1708920510688,https://hellobark.com/wp-content/uploads/corgi-1200.jpg,Describe this image.,"The image features a cute brown and white dog lying on a lush green lawn. The dog appears to be enjoying its time in the grass, possibly playing or relaxing. There are several other dogs visible in the background, but they are not as prominent as the main subject of the image.  In addition to the dogs, there is a person standing near the left side of the image, watching over the scene. The overall atmosphere is peaceful and pleasant, with the sun shining down on the dogs and the green grass.","The image features a cute brown and white dog lying on a lush green lawn. The dog appears to be enjoying its time in the grass, possibly playing or relaxing. There are several other dogs visible in the background, but they are not as prominent as the main subject of the image.  In addition to the dogs, there is a person standing near the left side of the image, watching over the scene. The overall atmosphere is peaceful and pleasant, with the sun shining down on the dogs and the green grass.",2024-02-26 04:08:42.000000,10.493644714355469,dislike,2
36,1708920535449,https://hellobark.com/wp-content/uploads/corgi-1200.jpg,Which dog breed is this?,corgi yes,corgi yes,2024-02-26 04:08:57.000000,1.1304702758789062,like,2
37,1708920559481,https://hellobark.com/wp-content/uploads/corgi-1200.jpg,How does he look?,happy 100%,happy 100%,2024-02-26 04:09:21.000000,1.3363711833953857,like,2
38,1708920580425,https://hellobark.com/wp-content/uploads/corgi-1200.jpg,What is he feeling?,happy,happy,2024-02-26 04:09:41.000000,0.8809969425201416,dislike,2
39,1708920595961,https://hellobark.com/wp-content/uploads/corgi-1200.jpg,Where is he from?,Englandics 100,Englandics 100,2024-02-26 04:09:58.000000,1.407796859741211,dislike,2
40,1708920612410,https://hellobark.com/wp-content/uploads/corgi-1200.jpg,Is there anything special about him?,he is a corgi,he is a corgi,2024-02-26 04:10:14.000000,1.2388744354248047,dislike,2
41,1708920618571,https://hellobark.com/wp-content/uploads/corgi-1200.jpg,Can he swim?,no yes,no yes,2024-02-26 04:10:19.000000,0.9742753505706787,dislike,2
42,1708920648371,https://hellobark.com/wp-content/uploads/corgi-1200.jpg,What is he good at?,playingunderdog ​,playingunderdog ​,2024-02-26 04:10:50.000000,1.4034349918365479,dislike,2
43,1708920668515,https://hellobark.com/wp-content/uploads/corgi-1200.jpg,how to adopt one?,go to pound,go to pound,2024-02-26 04:11:09.000000,1.2020866870880127,dislike,2
44,1708920686277,https://hellobark.com/wp-content/uploads/corgi-1200.jpg,Does he bite?,no yes,no yes,2024-02-26 04:11:27.000000,0.973067045211792,dislike,2
45,1708920701886,https://hellobark.com/wp-content/uploads/corgi-1200.jpg,Is he cute?,yes yes,yes yes,2024-02-26 04:11:43.000000,0.9741718769073486,like,2
46,1708920825409,https://www.brilliantnews.com/wp-content/uploads/2017/09/disney.jpg,Describe this image.,"The image features a group of Disney characters, including Mickey Mouse, Minnie Mouse, Donald Duck, and Goofy. They are posing for a photo on a green carpet in front of a backdrop. There are several people standing around the characters, likely waiting for their turn to take a picture with them. In total, there are at least 12 people present in the scene. Additionally, there are several chairs scattered around the area, providing seating options for those waiting in line. A potted plant can be seen in the background, adding some greenery to the scene.","The image features a group of Disney characters, including Mickey Mouse, Minnie Mouse, Donald Duck, and Goofy. They are posing for a photo on a green carpet in front of a backdrop. There are several people standing around the characters, likely waiting for their turn to take a picture with them. In total, there are at least 12 people present in the scene. Additionally, there are several chairs scattered around the area, providing seating options for those waiting in line. A potted plant can be seen in the background, adding some greenery to the scene.",2024-02-26 04:13:57.000000,11.82015347480774,dislike,2
47,1708920859323,https://www.brilliantnews.com/wp-content/uploads/2017/09/disney.jpg,Who are they?,Mickey Mouse and friends,Mickey Mouse and friends,2024-02-26 04:14:20.000000,1.1469926834106445,like,2
48,1708920875653,https://www.brilliantnews.com/wp-content/uploads/2017/09/disney.jpg,Where are they from?,Disneyland,Disneyland,2024-02-26 04:14:36.000000,0.8280410766601562,like,2
49,1708920896606,https://www.brilliantnews.com/wp-content/uploads/2017/09/disney.jpg,Which kinds of animal are they?,Disney charactersic 2 dogs and 3 mice,Disney charactersic 2 dogs and 3 mice,2024-02-26 04:14:58.000000,1.880772590637207,dislike,2
50,1708921549038,https://www.brilliantnews.com/wp-content/uploads/2017/09/disney.jpg,Do children like them?,yes yes,yes yes,2024-02-26 04:25:57.000000,8.097306489944458,dislike,2
51,1708921812329,https://th.bing.com/th/id/R.498589db9a3498c7ea59697b1a199c76?rik=HyKxZeH0PARdhg&riu=http%3a%2f%2fimages6.fanpop.com%2fimage%2fphotos%2f36600000%2fDisney-Princess-image-disney-princess-36601083-300-169.jpg&ehk=fvIt5U5Z1k3tW47il1XI%2fmDkt34M%2f28RUHwgrh7YV3g%3d&risl=&pid=ImgRaw&r=0,Who are they?,mermaid 2,mermaid 2,2024-02-26 04:30:14.000000,1.1960954666137695,dislike,2
52,1708921824288,https://th.bing.com/th/id/R.498589db9a3498c7ea59697b1a199c76?rik=HyKxZeH0PARdhg&riu=http%3a%2f%2fimages6.fanpop.com%2fimage%2fphotos%2f36600000%2fDisney-Princess-image-disney-princess-36601083-300-169.jpg&ehk=fvIt5U5Z1k3tW47il1XI%2fmDkt34M%2f28RUHwgrh7YV3g%3d&risl=&pid=ImgRaw&r=0,What is her name?,ariel 2,ariel 2,2024-02-26 04:30:26.000000,1.0948963165283203,dislike,2
53,1708921836833,https://th.bing.com/th/id/R.498589db9a3498c7ea59697b1a199c76?rik=HyKxZeH0PARdhg&riu=http%3a%2f%2fimages6.fanpop.com%2fimage%2fphotos%2f36600000%2fDisney-Princess-image-disney-princess-36601083-300-169.jpg&ehk=fvIt5U5Z1k3tW47il1XI%2fmDkt34M%2f28RUHwgrh7YV3g%3d&risl=&pid=ImgRaw&r=0,Where does she live?,"underwater 101 dalmatians the puppies, 2000 animated film","underwater 101 dalmatians the puppies, 2000 animated film",2024-02-26 04:30:40.000000,2.714430332183838,dislike,2
